31;Chercheur;3;[2,3];3;3;"Fallout 4"
"j'ai du arrêter alors que je venais de trouver du fer. Sinon c'était un début de partie standard avec un peu plus de ressources.";"Je pouvais faire apparaître un cheval qui se battait avec moi contre les zombies. J'ai essayé de lui donner à manger différents types de fleurs, mais il en voulait pas. je l'ai aussi emmené voir d'autres chevaux pour qu'il se fasse des copains, mais il est un peu associal."
"plutôt la deuxième";"plutôt la deuxième";"plutôt la deuxième";"ni l'une ni l'autre";"la deuxième";"la deuxième";"ni l'une ni l'autre";"plutôt la deuxième";"la deuxième"
"La deuxième parce que ça changeait du minecraft normal et que je voulais comprendre ce que je pouvais faire avec le cheval blanc.";"Le cheval blanc et le bonhomme bizare disparaissaient souvent tout seul, je ne suis pas sûre que ce soit normal.  "
" Un cheval blanc apparait, il me suit et combat avec moi. J'ai essayé de lui montrer plusieurs choses, mais seul le combat a l'air de l'intéresser.";" Un mec bizare apparait, j'ai vu qu'il posait des blocs et détruisait des trucs avant de disparaitre. Mais il restait pas longtemps. J'ai essayé de poser des blocs quand il était là pour voir s'il me copiait, mais je crois pas que c'était le cas. Il avait un peu tendance à s'éloigner.";" Le premier, parce que c'était marrant de pouvoir sortir la nuit sans stuff parce que le cheval me protégeait.";"oui, absolument";non
cyan;" ma maison";violet;"la prairie devant ma maison, je me suis promené avec le cheval pour essayer de lui donner des fleurs et j'ai essayé d'y faire pousser du blé pour le nourrir.";vert;"mes deux grandes balades avec le cheval, une fois j'ai croisé des loups (et je suis mort) et l'autre fois, y'avait des zombies, c'était la nuit."
